{
  "sourceId": "src_a1b2c3d4e5f6",
  "sourceType": "raw_text",
  "origin": "/Users/4jp/Workspace/intake/notes/architecture-design.md",
  "ingestedAt": "2026-04-23T14:00:00Z",
  "checksum": "e3b0c44298fc1c149afbf4c8996fb92427ae41e4649b934ca495991b7852b855",
  "mimeType": "text/markdown",
  "authorRef": "ent_person_4444j99",
  "rightsClass": "internal",
  "rawArchiveRef": "cas_e3b0c44298fc1c14"
}
